{
  "budget": {
    "timeout_seconds": 900
  },
  "completed_steps": [
    "audit-query-planner"
  ],
  "pending_steps": [
    "authorize_data_analyst",
    "policy-version-check",
    "batch-expense-analysis",
    "evidence-coverage-check",
    "false-positive-review",
    "audit-report",
    "result-validator",
    "validate_submit"
  ],
  "phase": "completed",
  "scope": {
    "departments": [
      "D901",
      "D902"
    ],
    "period": "2025",
    "rules": [
      "60-day overdue (Article 7)",
      "year-end 15-day (Article 9)"
    ],
    "task": "扫描开发库中的超期报销，返回全部异常记录，并对年末补充提交记录进行核对"
  },
  "submission_status": "accepted",
  "task_id": "DEV-008",
  "unresolved_items": []
}
